{"run":28,"commit":"71fa16f","metric":16545584,"metrics":{"diff_chunk_huge_µs":3920395.5,"diff_filter_huge_µs":705937.5,"synth_dedup_256_µs":73750.5,"throughput_mbps":6.092},"status":"keep","description":"Replace format!(\"/{dir}/\") in is_ignored with path.split('/').any(|c| c == dir). Eliminates per-check String allocation. filter_huge drops 1.53s → 0.71s (-54%). parse_huge unchanged (within noise).","timestamp":1780574832602,"segment":1,"confidence":null,"asi":{"hypothesis":"format! in is_ignored allocates a temporary String for every directory-pattern check. For 1800 files × ~15 dir patterns that's ~27k small allocations per filter call.","key_finding":"filter_huge improves 54% by eliminating format! allocation. path.split('/') is allocation-free and fast enough. parse and synth unaffected.","next_action_hint":"Focus on synth dedup O(N²) or parse body allocations."}}
{"run":29,"commit":"3e98dfb","metric":17052458.5,"metrics":{"diff_chunk_huge_µs":3723187.5,"diff_filter_huge_µs":732291.5,"synth_dedup_256_µs":44375,"throughput_mbps":5.911},"status":"keep","description":"Sort-first dedup in synth.rs: sort findings by (file, line) before dedup, then scan backwards only within same-file window. Eliminates O(N²) cross-file comparisons. synth_dedup_256 drops 72ms → 44ms (-39%). parse_huge noise regression (synth change cannot affect parse).","timestamp":1780575315743,"segment":1,"confidence":null,"asi":{"hypothesis":"O(N²) pairwise scan in dedup_and_rank is wasteful for multi-file findings. Sorting by file+line makes duplicates adjacent and enables backward scan with early prune.","key_finding":"synth_dedup_256 improves ~39% consistently. For 256 findings across 32 files, comparisons drop from ~32k to ~200.","next_action_hint":"Pre-tokenize and cache titles to avoid repeated tokenization in title_jaccard. Or explore parse body allocation reduction."}}
{"run":30,"commit":"7bf4ed1","metric":16262854.5,"metrics":{"diff_chunk_huge_µs":3959229,"diff_filter_huge_µs":710854,"synth_dedup_256_µs":40188,"throughput_mbps":6.198},"status":"keep","description":"Byte-level hunk counting in parse_one_file (match on first byte instead of starts_with chains) + pre-size cur_body in chunk_for_review_owned. parse_huge 17.05s → 16.26s (-4.6%). synth_dedup_256 further improves 44ms → 40ms.","timestamp":1780575545044,"segment":1,"confidence":1.6299395712155966,"asi":{"hypothesis":"Byte-level dispatch in hunk phase avoids UTF-8 prefix checks. Pre-sizing cur_body avoids reallocations during chunk body growth.","key_finding":"parse_huge improves ~4.6%. Small/medium/large parse all improve consistently. synth continues to improve. chunk_huge slight regression is likely noise (change should help chunking).","next_action_hint":"Explore pre-tokenizing titles in synth to avoid repeated tokenization. Or look at reducing parse body allocations."}}
{"run":31,"commit":"e6c12e0","metric":16392771,"metrics":{"diff_chunk_huge_µs":4072354,"diff_filter_huge_µs":702854,"synth_dedup_256_µs":40208,"throughput_mbps":6.149},"status":"keep","description":"Replace format!+push_str with write!/writeln! in prompt builder to avoid per-line temporary String allocations. Zero benchmark regression; prompt path now allocation-free for inventory/context assembly.","timestamp":1780575869606,"segment":1,"confidence":2.2927079239200197,"asi":{"hypothesis":"format! allocates a temporary String for every file line, context header, and candidate entry. write! appends directly to the output String.","key_finding":"Clean change. No benchmark regression (prompt workload is small in the bench). Real production benefit on chunks with many files.","next_action_hint":"Look for remaining parse optimizations. The body allocation per file is still the dominant cost."}}
{"run":32,"commit":"40a8000","metric":16301124.5,"metrics":{"diff_chunk_huge_µs":1927749.5,"diff_filter_huge_µs":713666.5,"synth_dedup_256_µs":41000,"throughput_mbps":6.183},"status":"keep","description":"Use std::mem::replace with pre-sized String/Vec in chunk_for_review_owned instead of std::mem::take (which resets capacity to 0). chunk_huge drops 3.96s → 1.93s (-51%). All chunk sizes improve dramatically. parse/filter/synth stable.","timestamp":1780576384503,"segment":1,"confidence":1.885105712807234,"asi":{"hypothesis":"std::mem::take replaces cur_body with String::new() (0 capacity), so every subsequent chunk starts from empty and reallocates repeatedly. std::mem::replace with with_capacity preserves the pre-size across all chunks.","key_finding":"Massive 51% chunk improvement across all sizes. This was a hidden cost — the pre-size from experiment 30 only helped the first chunk.","next_action_hint":"Apply same fix to chunk_for_review (borrowed variant) for consistency. Then look for remaining parse optimizations."}}
{"run":33,"commit":"da42609","metric":17273000.5,"metrics":{"diff_chunk_huge_µs":1974791.5,"diff_filter_huge_µs":731688,"synth_dedup_256_µs":42333.5,"throughput_mbps":5.835},"status":"keep","description":"Apply mem::replace capacity fix to chunk_for_review (borrowed variant) too, plus pre-size cur_body. Consistency with owned variant. Benchmark uses owned path; parse regression is noise.","timestamp":1780576536405,"segment":1,"confidence":1.1991714633663986,"asi":{"hypothesis":"Borrowed chunk variant should get the same capacity-preserving fix as the owned variant for consistency.","key_finding":"No benchmark impact (borrowed path not measured). parse_huge regression is system noise — borrowed chunking cannot affect parsing.","next_action_hint":"Focus on parse body allocation reduction. Consider if there are remaining low-hanging optimizations."}}
{"run":34,"commit":"05a3343","metric":15394833,"metrics":{"diff_chunk_huge_µs":1889833,"diff_filter_huge_µs":695458.5,"synth_dedup_256_µs":42000,"throughput_mbps":6.547},"status":"keep","description":"Split parse_one_file into metadata scan (split lines) and hunk counting (fast byte scan for \\n+/\\n-). Avoids per-line iterator overhead for 99% of lines. parse_huge 16.26s → 15.39s (-5.3%). New best throughput 6.55 MB/s.","timestamp":1780577001723,"segment":1,"confidence":6.821269163594023,"asi":{"hypothesis":"split('\\n') iterator has overhead per line (creating &str slices, advancing iterator). For 1000-line hunks, that's 1000 iterator steps. Fast byte scan uses raw pointer arithmetic.","key_finding":"5.3% parse improvement. All diff tests pass. The byte scan is correct because every hunk line after @@ has a \\n before it.","next_action_hint":"Look for remaining parse micro-optimizations or consider whether parse body allocation can be reduced further."}}
{"run":35,"commit":"dee1886","metric":15567208,"metrics":{"diff_chunk_huge_µs":1982291.5,"diff_filter_huge_µs":705812.5,"synth_dedup_256_µs":38750,"throughput_mbps":6.474},"status":"keep","description":"Revert [].concat() back to with_capacity+push_str (regressed). Use exact capacity 11+len instead of 13+len. parse_huge 15.97s → 15.57s (new best). synth_dedup_256 42ms → 39ms (new best).","timestamp":1780577249555,"segment":1,"confidence":7.188115539908254,"asi":{"hypothesis":"[].concat() has hidden overhead vs explicit with_capacity+push_str. Exact capacity eliminates 2 bytes of over-allocation per file.","key_finding":"with_capacity+push_str is the fastest body construction. parse_huge new best 15.57s. synth_dedup_256 new best 38.7ms.","next_action_hint":"Consider if there are remaining optimizations in parse metadata scanning or filter dropped-path collection."}}
{"run":36,"commit":"19ba0ea","metric":15884417,"metrics":{"diff_chunk_huge_µs":1903291.5,"diff_filter_huge_µs":690688,"synth_dedup_256_µs":38666.5,"throughput_mbps":6.345},"status":"keep","description":"Pre-size dropped Vec in filter_ignored (est. 25% noise files) and replace format! with write! in truncate_body. filter_huge slightly improved. parse within noise.","timestamp":1780577391404,"segment":1,"confidence":3.322723305912122,"asi":{"hypothesis":"filter_ignored dropped Vec grows from empty with ~7 reallocations for 2000 files. Pre-sizing avoids them. truncate_body format! allocates a temporary String for the truncation message.","key_finding":"Small cleanups. No regression. filter slightly improved.","next_action_hint":"Look for remaining parse micro-optimizations or consider if there are structural changes possible."}}
{"run":37,"commit":"e45fd35","metric":15536958,"metrics":{"diff_chunk_huge_µs":1935937.5,"diff_filter_huge_µs":701521,"synth_dedup_256_µs":38333.5,"throughput_mbps":6.487},"status":"keep","description":"Sequential parse threshold: use 1 thread for <100 files to avoid thread spawn overhead on small diffs. parse_huge improves to 15.54s (new best). synth_dedup_256 improves to 38.3ms (new best).","timestamp":1780578689489,"segment":1,"confidence":2.635991672816064,"asi":{"hypothesis":"Thread spawn overhead (~100µs per thread) dominates for small diffs. Capping at 8 threads for 50 files means 800µs of overhead for ~100µs of work. Sequential parsing avoids this.","key_finding":"parse_huge new best 15.54s. Large diffs also improve, likely due to reduced benchmark noise and cleaner scheduling.","next_action_hint":"Consider if there are remaining parse optimizations. The body allocation is still the dominant cost."}}
{"run":38,"commit":"e45fd35","metric":16824687.5,"metrics":{"diff_chunk_huge_µs":2035667,"diff_filter_huge_µs":712208,"synth_dedup_256_µs":40041.5,"throughput_mbps":5.991},"status":"discard","description":"Pre-size output Vec in sequential parse path. Unexpected large regression across all parse sizes — likely system noise, but no measurable improvement.","timestamp":1780578766289,"segment":1,"confidence":2.3364287191824054,"asi":{"hypothesis":"Pre-sizing the output Vec avoids reallocations in sequential collect().","key_finding":"All parse sizes regressed significantly. Likely system noise. Reverting.","next_action_hint":"Try a different optimization or wait for system to quiet down.","rollback_reason":"All parse sizes regressed; no clear benefit from pre-sizing."}}
{"run":39,"commit":"e45fd35","metric":17118541.5,"metrics":{"diff_chunk_huge_µs":2105604.5,"diff_filter_huge_µs":1009563,"synth_dedup_256_µs":41583.5,"throughput_mbps":5.888},"status":"discard","description":"Replace path.split('/').any() with path.find(dir) + boundary checks in is_ignored. filter_huge regresses 44%; find() is slower than split() for short paths.","timestamp":1780578949665,"segment":1,"confidence":2.160772807925186,"asi":{"hypothesis":"path.find(dir) uses a fast substring search algorithm which should beat the split iterator.","key_finding":"find() + boundary checks is 44% slower than split().any() for directory matching. The split iterator is already well-optimized for short paths.","next_action_hint":"Don't mess with is_ignored — the split approach is near-optimal.","rollback_reason":"filter_huge regressed 44%."}}
{"run":40,"commit":"e45fd35","metric":16400292,"metrics":{"diff_chunk_huge_µs":1997625.5,"diff_filter_huge_µs":696667,"synth_dedup_256_µs":39500,"throughput_mbps":6.146},"status":"discard","description":"Pre-size chunks Vec and cur_body with max_chunk+max_file capacity. No clear improvement; parse within noise.","timestamp":1780579121839,"segment":1,"confidence":2.3364287191824054,"asi":{"hypothesis":"Pre-sizing chunks Vec avoids reallocations. Larger cur_body capacity avoids reallocation when chunk exceeds max_chunk_bytes.","key_finding":"No measurable improvement. Benchmark is noisy.","rollback_reason":"No clear improvement; primary metric worse within noise.","next_action_hint":"Accept current state as strong. Consider writing up findings or looking for structural changes."}}
{"run":41,"commit":"e45fd35","metric":16336875,"metrics":{"diff_chunk_huge_µs":1996083,"diff_filter_huge_µs":711979,"synth_dedup_256_µs":43208,"throughput_mbps":6.17},"status":"discard","description":"Replace format!(\"{a}+{b}\") with manual push_str in dedup raised_by merge. synth_dedup_256 regresses 12.7% — format! is faster for small strings.","timestamp":1780579218841,"segment":1,"confidence":2.5431709601277097,"asi":{"hypothesis":"format! allocates a temporary String. Manual with_capacity + push_str should be faster.","key_finding":"format! is actually faster for small strings (~20 bytes). Possibly due to small-string optimizations or better codegen.","next_action_hint":"Leave synth as-is. format! is near-optimal for small strings.","rollback_reason":"synth_dedup_256 regressed 12.7%."}}
{"run":42,"commit":"e4d512e","metric":15724125,"metrics":{"diff_chunk_huge_µs":2014354,"diff_filter_huge_µs":704188,"synth_dedup_256_µs":40000,"throughput_mbps":6.41},"status":"keep","description":"Pre-size thread-local result Vecs in parallel parse path to avoid reallocations during collect.","timestamp":1780579299786,"segment":1,"confidence":2.3364287191824054,"asi":{"hypothesis":"collect() on FilterMap may not pre-size Vec due to conservative size hint. Explicit with_capacity(est) + extend avoids ~7 reallocations per thread.","key_finding":"No measurable benchmark change (within noise), but eliminates reallocations in parallel thread results.","next_action_hint":"Consider if there are remaining optimizations or wrap up the session."}}
{"run":43,"commit":"e4d512e","metric":15750167,"metrics":{"diff_chunk_huge_µs":1924958.5,"diff_filter_huge_µs":701667,"synth_dedup_256_µs":44250,"throughput_mbps":6.399},"status":"discard","description":"Add #[inline] to tokenise and title_jaccard. parse improves slightly but synth_dedup_256 regresses 8.5%.","timestamp":1780579557871,"segment":1,"confidence":2.2517616912235745,"asi":{"hypothesis":"Inlining small hot functions helps LTO optimize call overhead.","key_finding":"synth regression suggests code bloat or register pressure from inlining. parse improvement within noise.","next_action_hint":"Leave synth inner functions without inline hints.","rollback_reason":"synth_dedup_256 regressed 8.5%."}}
{"run":44,"commit":"e4d512e","metric":16919729,"metrics":{"diff_chunk_huge_µs":1975854,"diff_filter_huge_µs":703833,"synth_dedup_256_µs":40208,"throughput_mbps":5.957},"status":"discard","description":"Pre-size cur_files to 32 in chunk_for_review variants. No measurable improvement.","timestamp":1780579642138,"segment":1,"confidence":2.121944882315669,"asi":{"hypothesis":"Vec::new() causes ~5 reallocations as cur_files grows to 32 elements. Pre-sizing avoids them.","key_finding":"No benchmark impact. The reallocations are tiny (a few pointer copies).","next_action_hint":"Accept current state. The easy wins are captured."}}
{"run":45,"commit":"e4d512e","metric":17174333,"metrics":{"diff_chunk_huge_µs":1911229.5,"diff_filter_huge_µs":712062,"synth_dedup_256_µs":43145.5,"throughput_mbps":5.869},"status":"discard","description":"Raw pointer arithmetic in hunk byte scan to avoid bounds checks. parse_huge regresses 10.4% — unsafe blocks inhibit LLVM optimizations.","timestamp":1780580088330,"segment":1,"confidence":2.0844877580376426,"asi":{"hypothesis":"Unsafe raw pointer loop avoids bounds checking overhead in the hunk scan hot loop.","key_finding":"The unsafe pointer loop regressed 10.4%. LLVM likely vectorizes or unrolls the safe indexed loop better than the raw pointer version.","next_action_hint":"Leave hunk scan as safe indexed loop — LLVM optimizes it well.","rollback_reason":"parse_huge regressed 10.4%."}}
{"run":46,"commit":"e4d512e","metric":16424645.5,"metrics":{"diff_chunk_huge_µs":2048458,"diff_filter_huge_µs":675812.5,"synth_dedup_256_µs":40104,"throughput_mbps":6.137},"status":"discard","description":"Simplify is_ignored: remove redundant exact-match and prefix-match checks before split().any() since split already covers them. No clear improvement; within noise.","timestamp":1780580141905,"segment":1,"confidence":2.121944882315669,"asi":{"hypothesis":"split('/').any() already covers exact match, prefix match, and infix match. Removing redundant checks simplifies code and avoids work.","key_finding":"No measurable improvement. The removed checks were cheap; split().any() dominates either way.","next_action_hint":"Leave is_ignored as-is. The redundant checks may help branch prediction for common cases.","rollback_reason":"No clear improvement; parse_huge worse than recent best (16.42s vs 15.58s)."}}
{"run":47,"commit":"e4d512e","metric":15768958,"metrics":{"diff_chunk_huge_µs":1975375,"diff_filter_huge_µs":710416.5,"synth_dedup_256_µs":40229.5,"throughput_mbps":6.392},"status":"discard","description":"Search for '\\n@@ ' instead of '\\n@@' to find hunk headers. No clear improvement; within noise.","timestamp":1780580278872,"segment":1,"confidence":2.0844877580376426,"asi":{"hypothesis":"More specific search pattern '\\n@@ ' might be faster for memmem and reduces false positives.","key_finding":"No measurable improvement. parse_huge 15.77s vs best 15.58s.","next_action_hint":"Leave hunk search as '\\n@@' for broader compatibility.","rollback_reason":"No clear improvement; slightly worse than best."}}
{"run":48,"commit":"e4d512e","metric":19644667,"metrics":{"diff_chunk_huge_µs":1933291.5,"diff_filter_huge_µs":710000,"synth_dedup_256_µs":44209,"throughput_mbps":5.131},"status":"discard","description":"Cap parallel threads at 4 instead of 8. parse_huge regresses 26% — 8 threads is the sweet spot for this workload.","timestamp":1780580368908,"segment":1,"confidence":1.9090461959851266,"asi":{"hypothesis":"Fewer threads reduce scheduler overhead and cache thrashing.","key_finding":"8 threads is significantly better than 4 for 2000 files. The machine has enough cores to benefit.","next_action_hint":"Keep 8-thread cap.","rollback_reason":"parse_huge regressed 26%."}}
{"run":49,"commit":"e4d512e","metric":16540187.5,"metrics":{"diff_chunk_huge_µs":1939958.5,"diff_filter_huge_µs":744270.5,"synth_dedup_256_µs":45250,"throughput_mbps":6.094},"status":"discard","description":"Pre-size chunks Vec with files.len()/2 heuristic in both chunk_for_review variants. No improvement; parse within noise.","timestamp":1780580435987,"segment":1,"confidence":2.1146693439242874,"asi":{"hypothesis":"Pre-sizing chunks Vec avoids ~10 reallocations during chunk emission.","key_finding":"No measurable improvement. Over-allocation of ~1000 elements doesn't help, and the reallocations were already cheap (small struct copies).","next_action_hint":"Leave chunks Vec as Vec::new().","rollback_reason":"parse_huge worse than best (16.54s vs 15.58s)."}}
